{
  "$schema": "https://json-schema.org/draft/2020-12/schema",
  "title": "Product radar daily event list",
  "type": "array",
  "items": {
    "type": "object",
    "required": [
      "id",
      "published_at",
      "collected_at",
      "lane",
      "source_tier",
      "entity",
      "signal_type",
      "title",
      "facts",
      "source_urls",
      "analysis",
      "insight",
      "recommended_action",
      "confidence",
      "score"
    ],
    "properties": {
      "id": {"type": "string"},
      "published_at": {"type": "string"},
      "collected_at": {"type": "string"},
      "lane": {"type": "string"},
      "source_tier": {"enum": ["P0", "P1", "P2", "internal"]},
      "entity": {"type": "string"},
      "signal_type": {"type": "string"},
      "title": {"type": "string"},
      "facts": {"type": "array", "items": {"type": "string"}},
      "source_urls": {"type": "array", "minItems": 1, "items": {"type": "string", "format": "uri"}},
      "analysis": {"type": "string"},
      "insight": {"type": "string"},
      "recommended_action": {"type": "string"},
      "confidence": {"enum": ["high", "medium", "low"]},
      "score": {"type": "integer", "minimum": 0, "maximum": 100}
    },
    "additionalProperties": true
  }
}

